{
  "schema": "shieldkit-labs/p2-gate-b/equal-relation-experiment/v1",
  "contractId": "contract:gate-b-equal-relations-v1",
  "status": "contract-only-unmeasured",
  "scope": {
    "phase": "P2",
    "gate": "Gate-B",
    "relationRef": "relation:pool-action-fv1",
    "purpose": "Equal semantic relation corpus across native, standard Libauth, real unmodified BCHN, and LeanBCH support surfaces.",
    "evidenceClassification": "not-evidence"
  },
  "frontier": {
    "fieldContractPath": "research/field-frontier-contract.md",
    "fieldContractStatus": "frozen-experiment-representation-boundary-v1",
    "compositionPath": "research/circle-fri-candidate-matrix.v2.json",
    "compositionStatus": "research-only-no-selection",
    "selectedTupleCount": 0,
    "selectionStatus": "closed"
  },
  "selection": {
    "executionStatus": "blocked",
    "selectedTupleCount": 0,
    "frozenCandidateTupleCount": 0,
    "candidateSpecificExecution": "blocked-pending-frozen-descriptor-and-certificates",
    "candidateRoster": [
      { "candidateSlotId": "candidate-slot:m13-d10", "fieldSpecRef": "field-spec:m13-d10", "status": "blocked-missing-frozen-descriptor-or-certificate", "frozenCandidateTupleRef": null, "executionAllowed": false },
      { "candidateSlotId": "candidate-slot:m17-d8", "fieldSpecRef": "field-spec:m17-d8", "status": "blocked-missing-frozen-descriptor-or-certificate", "frozenCandidateTupleRef": null, "executionAllowed": false },
      { "candidateSlotId": "candidate-slot:m19-d7", "fieldSpecRef": "field-spec:m19-d7", "status": "blocked-missing-frozen-descriptor-or-certificate", "frozenCandidateTupleRef": null, "executionAllowed": false },
      { "candidateSlotId": "candidate-slot:m31-d1", "fieldSpecRef": "field-spec:m31-d1", "status": "blocked-missing-frozen-descriptor-or-certificate", "frozenCandidateTupleRef": null, "executionAllowed": false },
      { "candidateSlotId": "candidate-slot:m31-d4", "fieldSpecRef": "field-spec:m31-d4", "status": "blocked-missing-frozen-descriptor-or-certificate", "frozenCandidateTupleRef": null, "executionAllowed": false },
      { "candidateSlotId": "candidate-slot:m31-d5", "fieldSpecRef": "field-spec:m31-d5", "status": "blocked-missing-frozen-descriptor-or-certificate", "frozenCandidateTupleRef": null, "executionAllowed": false },
      { "candidateSlotId": "candidate-slot:m31-d6", "fieldSpecRef": "field-spec:m31-d6", "status": "blocked-missing-frozen-descriptor-or-certificate", "frozenCandidateTupleRef": null, "executionAllowed": false },
      { "candidateSlotId": "candidate-slot:m61-d2", "fieldSpecRef": "field-spec:m61-d2", "status": "blocked-missing-frozen-descriptor-or-certificate", "frozenCandidateTupleRef": null, "executionAllowed": false },
      { "candidateSlotId": "candidate-slot:m61-d3", "fieldSpecRef": "field-spec:m61-d3", "status": "blocked-missing-frozen-descriptor-or-certificate", "frozenCandidateTupleRef": null, "executionAllowed": false },
      { "candidateSlotId": "candidate-slot:m89-d2", "fieldSpecRef": "field-spec:m89-d2", "status": "blocked-missing-frozen-descriptor-or-certificate", "frozenCandidateTupleRef": null, "executionAllowed": false },
      { "candidateSlotId": "candidate-slot:m107-d2", "fieldSpecRef": "field-spec:m107-d2", "status": "blocked-missing-frozen-descriptor-or-certificate", "frozenCandidateTupleRef": null, "executionAllowed": false },
      { "candidateSlotId": "candidate-slot:m127-d1", "fieldSpecRef": "field-spec:m127-d1", "status": "blocked-missing-frozen-descriptor-or-certificate", "frozenCandidateTupleRef": null, "executionAllowed": false },
      { "candidateSlotId": "candidate-slot:m127-d2", "fieldSpecRef": "field-spec:m127-d2", "status": "blocked-missing-frozen-descriptor-or-certificate", "frozenCandidateTupleRef": null, "executionAllowed": false }
    ]
  },
  "preExecutionGates": [
    {
      "gateId": "gate:exact-polynomial-or-tower",
      "kind": "exact-polynomial-or-tower",
      "status": "blocked",
      "requiredBeforeCandidateExecution": true,
      "passCondition": "Freeze the exact monic irreducible polynomial or typed tower, basis, limb order, reduction, square, inverse-hint, and canonical encoding for the candidate.",
      "requiredDescriptorFields": ["exactPolynomialOrTower", "coefficientBasis", "limbOrder", "reductionRelation", "canonicalEncoding"]
    },
    {
      "gateId": "gate:dual-certificate-replay",
      "kind": "dual-certificate-replay",
      "status": "blocked",
      "requiredBeforeCandidateExecution": true,
      "passCondition": "The complete prime and irreducibility/tower certificate is replayed successfully by both independent checker slots with identical canonical residues and conclusion.",
      "replays": [
        { "replayId": "replay:repository-checker", "independenceRole": "repository-checker", "status": "required-unrun", "artifactSlotId": "artifact:certificate-replay-repository" },
        { "replayId": "replay:independent-checker", "independenceRole": "independent-cas-or-equivalently-reviewed-checker", "status": "required-unrun", "artifactSlotId": "artifact:certificate-replay-independent" }
      ]
    },
    {
      "gateId": "gate:typed-descriptor",
      "kind": "typed-descriptor",
      "status": "blocked",
      "requiredBeforeCandidateExecution": true,
      "passCondition": "The candidate binds every field role, Circle domain, DEEP strategy, embedding, sampler, and soundness consumer without an implicit alias or unfrozen descriptor.",
      "requiredDescriptorFields": ["roleAssignment", "circleDomain", "deepStrategy", "embeddings", "challengeSamplers", "soundnessEventDag"]
    }
  ],
  "relationSuite": {
    "suiteId": "suite:gate-b-equal-relations-v1",
    "seedHex": "0123456789abcdef",
    "identicalAcrossEngines": true,
    "inputEncodingRule": "Every engine receives the same canonical fixed-width bytes for the same relation, case, and mutation; no host-side normalization precedes VM execution.",
    "relations": [
      {
        "relationId": "relation:e-mac",
        "label": "E-MAC",
        "expression": "D=A*B+C",
        "normalizedExpression": "eq(D,add(mul(A,B),C))",
        "operands": ["A", "B", "C", "D"],
        "casePlanRef": "cases:gate-b-shared-v1",
        "mutationPlanRef": "mutations:gate-b-shared-v1"
      },
      {
        "relationId": "relation:e-square-mac",
        "label": "E-SQUARE-MAC",
        "expression": "D=A^2+C",
        "normalizedExpression": "eq(D,add(square(A),C))",
        "operands": ["A", "C", "D"],
        "casePlanRef": "cases:gate-b-shared-v1",
        "mutationPlanRef": "mutations:gate-b-shared-v1"
      },
      {
        "relationId": "relation:e-inverse-check",
        "label": "E-INVERSE-CHECK",
        "expression": "A!=0 && A*H=1",
        "normalizedExpression": "and(ne(A,0),eq(mul(A,H),1))",
        "operands": ["A", "H"],
        "casePlanRef": "cases:gate-b-shared-v1",
        "mutationPlanRef": "mutations:gate-b-shared-v1"
      }
    ]
  },
  "corpusSemantics": {
    "casePlanId": "cases:gate-b-shared-v1",
    "mutationPlanId": "mutations:gate-b-shared-v1",
    "seedHex": "0123456789abcdef",
    "categories": [
      { "categoryId": "category:valid", "acceptancePolicy": "relation-defined", "caseIdPrefix": "case:valid" },
      { "categoryId": "category:boundary", "acceptancePolicy": "relation-defined-with-boundary", "caseIdPrefix": "case:boundary" },
      { "categoryId": "category:random", "acceptancePolicy": "relation-defined-with-seed", "caseIdPrefix": "case:random" },
      { "categoryId": "category:metamorphic", "acceptancePolicy": "must-preserve-verdict", "caseIdPrefix": "case:metamorphic" },
      { "categoryId": "category:malformed", "acceptancePolicy": "must-reject", "caseIdPrefix": "case:malformed" }
    ],
    "caseSemantics": [
      { "caseId": "case:valid-canonical", "categoryId": "category:valid", "semanticRule": "Canonical in-range operands satisfying the named relation." },
      { "caseId": "case:boundary-zero-one", "categoryId": "category:boundary", "semanticRule": "Zero, one, and the largest canonical in-range values at every declared limb width." },
      { "caseId": "case:boundary-modulus", "categoryId": "category:boundary", "semanticRule": "Modulus, modulus plus one, and sign-boundary encodings are supplied as raw bytes and must not be normalized." },
      { "caseId": "case:random-seeded", "categoryId": "category:random", "semanticRule": "Deterministic seeded operands and relation outputs generated from seed 0123456789abcdef." },
      { "caseId": "case:metamorphic-commute", "categoryId": "category:metamorphic", "semanticRule": "Only relation-preserving operand/order transformations are applied; the verdict must be preserved." },
      { "caseId": "case:malformed-canonical", "categoryId": "category:malformed", "semanticRule": "Malformed raw encodings are presented directly to the parser and must reject before arithmetic." }
    ],
    "mutationSemantics": [
      { "mutationId": "mutation:wrong-length", "family": "wrong-length", "semanticRule": "Remove or append one or more bytes outside the exact fixed width.", "expectedEffect": "reject" },
      { "mutationId": "mutation:truncation", "family": "truncation", "semanticRule": "Truncate a canonical operand at every nonzero prefix length.", "expectedEffect": "reject" },
      { "mutationId": "mutation:trailing-bytes", "family": "trailing-bytes", "semanticRule": "Append bytes after an otherwise canonical operand.", "expectedEffect": "reject" },
      { "mutationId": "mutation:out-of-range", "family": "out-of-range", "semanticRule": "Use modulus, modulus plus one, and maximum-width values where outside the candidate range.", "expectedEffect": "reject" },
      { "mutationId": "mutation:sign-alias", "family": "sign-alias", "semanticRule": "Use negative-zero and alternate Script-number sign encodings without changing the raw payload role.", "expectedEffect": "reject" },